{
  "authority": "SKILL.md",
  "compilerVersion": "1.0.0",
  "generatedAt": "deterministic-build",
  "policy": {
    "generatedFromCurrentPublicBoundary": true,
    "privateSourcesAreNotRuntimeFallbacks": true,
    "projectPolicyIsNotExternalLaw": true
  },
  "rules": [
    {
      "authorityClass": "official-requirement",
      "category": "accessibility",
      "evidenceClass": "official-standard",
      "id": "ZTDE-A11Y-001",
      "implementationLocations": [
        "knowledge-base/benchmarks/knowledge-quality/knowledge-quality.yaml",
        "src/audit/rules/accessibility-name.ts"
      ],
      "modelLinks": [
        "ZTDE-MODEL-A11Y-001",
        "ZTDE-MODEL-VERIFY-002"
      ],
      "owner": "ZtotheZ",
      "rationale": "Stable ZTDE-A11Y-001 rule registry entry generated from maintained public source and bound to the V5 shadow model. This entry identifies where the rule is implemented or declared without making project policy an external legal or platform requirement.",
      "sourceIds": [
        "admission:ztde-kb-3b48275fd43ef6e3",
        "policy:ztothez-design-engineering-policy",
        "standard:wcag-2.2"
      ]
    },
    {
      "authorityClass": "project-policy",
      "category": "architecture",
      "evidenceClass": "owner-authored",
      "id": "ZTDE-ARCH-001",
      "implementationLocations": [
        "knowledge-base/benchmarks/corpus/corpus.yaml",
        "knowledge-base/benchmarks/knowledge-quality/knowledge-quality.yaml",
        "knowledge-base/benchmarks/portfolio-corpus/PROMOTED-RULES.md",
        "knowledge-base/benchmarks/portfolio-corpus/rule-fixtures/component-size-abstention.json",
        "knowledge-base/benchmarks/portfolio-corpus/rule-fixtures/component-size-negative.json",
        "knowledge-base/benchmarks/portfolio-corpus/rule-fixtures/component-size-positive.json",
        "src/audit/rules/component-size.ts"
      ],
      "modelLinks": [
        "ZTDE-MODEL-COMPONENT-001"
      ],
      "owner": "ZtotheZ",
      "rationale": "Stable ZTDE-ARCH-001 rule registry entry generated from maintained public source and bound to the V5 shadow model. This entry identifies where the rule is implemented or declared without making project policy an external legal or platform requirement.",
      "sourceIds": [
        "admission:ztde-kb-00515c30a71cfdc4",
        "admission:ztde-kb-1d098d15b2159e1e",
        "admission:ztde-kb-2e3fa0c5d06095d7",
        "admission:ztde-kb-3b48275fd43ef6e3",
        "admission:ztde-kb-3c21130405aa3bc5",
        "admission:ztde-kb-e211c40bdce6f530",
        "policy:ztothez-design-engineering-policy"
      ]
    },
    {
      "authorityClass": "project-policy",
      "category": "architecture",
      "evidenceClass": "owner-authored",
      "id": "ZTDE-ARCH-002",
      "implementationLocations": [
        "knowledge-base/benchmarks/corpus/corpus.yaml",
        "src/audit/rules/mixed-responsibilities.ts"
      ],
      "modelLinks": [
        "ZTDE-MODEL-COMPONENT-001"
      ],
      "owner": "ZtotheZ",
      "rationale": "Stable ZTDE-ARCH-002 rule registry entry generated from maintained public source and bound to the V5 shadow model. This entry identifies where the rule is implemented or declared without making project policy an external legal or platform requirement.",
      "sourceIds": [
        "admission:ztde-kb-e211c40bdce6f530",
        "policy:ztothez-design-engineering-policy"
      ]
    },
    {
      "authorityClass": "project-policy",
      "category": "project-policy-validation",
      "evidenceClass": "owner-authored",
      "id": "ZTDE-AUTHORITY-001",
      "implementationLocations": [
        "src/authority/compiler.ts"
      ],
      "modelLinks": [
        "ZTDE-MODEL-ABSTENTION-001"
      ],
      "owner": "ZtotheZ",
      "rationale": "Stable ZTDE-AUTHORITY-001 rule registry entry generated from maintained public source and bound to the V5 shadow model. This entry identifies where the rule is implemented or declared without making project policy an external legal or platform requirement.",
      "sourceIds": [
        "policy:ztothez-design-engineering-policy"
      ]
    },
    {
      "authorityClass": "project-policy",
      "category": "project-policy-validation",
      "evidenceClass": "owner-authored",
      "id": "ZTDE-AUTHORITY-002",
      "implementationLocations": [
        "src/authority/validator.ts"
      ],
      "modelLinks": [
        "ZTDE-MODEL-ABSTENTION-001"
      ],
      "owner": "ZtotheZ",
      "rationale": "Stable ZTDE-AUTHORITY-002 rule registry entry generated from maintained public source and bound to the V5 shadow model. This entry identifies where the rule is implemented or declared without making project policy an external legal or platform requirement.",
      "sourceIds": [
        "policy:ztothez-design-engineering-policy"
      ]
    },
    {
      "authorityClass": "heuristic",
      "category": "product-brief-validation",
      "evidenceClass": "owner-authored",
      "id": "ZTDE-BRIEF-001",
      "implementationLocations": [
        "src/product-brief/validator.ts"
      ],
      "modelLinks": [
        "ZTDE-MODEL-TASK-001"
      ],
      "owner": "ZtotheZ",
      "rationale": "Stable ZTDE-BRIEF-001 rule registry entry generated from maintained public source and bound to the V5 shadow model. This entry identifies where the rule is implemented or declared without making project policy an external legal or platform requirement.",
      "sourceIds": [
        "policy:ztothez-design-engineering-policy"
      ]
    },
    {
      "authorityClass": "heuristic",
      "category": "product-brief-validation",
      "evidenceClass": "owner-authored",
      "id": "ZTDE-BRIEF-101",
      "implementationLocations": [
        "src/product-brief/validator.ts"
      ],
      "modelLinks": [
        "ZTDE-MODEL-TASK-001"
      ],
      "owner": "ZtotheZ",
      "rationale": "Stable ZTDE-BRIEF-101 rule registry entry generated from maintained public source and bound to the V5 shadow model. This entry identifies where the rule is implemented or declared without making project policy an external legal or platform requirement.",
      "sourceIds": [
        "policy:ztothez-design-engineering-policy"
      ]
    },
    {
      "authorityClass": "heuristic",
      "category": "product-brief-validation",
      "evidenceClass": "owner-authored",
      "id": "ZTDE-BRIEF-201",
      "implementationLocations": [
        "src/product-brief/validator.ts"
      ],
      "modelLinks": [
        "ZTDE-MODEL-TASK-001"
      ],
      "owner": "ZtotheZ",
      "rationale": "Stable ZTDE-BRIEF-201 rule registry entry generated from maintained public source and bound to the V5 shadow model. This entry identifies where the rule is implemented or declared without making project policy an external legal or platform requirement.",
      "sourceIds": [
        "policy:ztothez-design-engineering-policy"
      ]
    },
    {
      "authorityClass": "heuristic",
      "category": "product-brief-validation",
      "evidenceClass": "owner-authored",
      "id": "ZTDE-BRIEF-202",
      "implementationLocations": [
        "src/product-brief/validator.ts"
      ],
      "modelLinks": [
        "ZTDE-MODEL-TASK-001"
      ],
      "owner": "ZtotheZ",
      "rationale": "Stable ZTDE-BRIEF-202 rule registry entry generated from maintained public source and bound to the V5 shadow model. This entry identifies where the rule is implemented or declared without making project policy an external legal or platform requirement.",
      "sourceIds": [
        "policy:ztothez-design-engineering-policy"
      ]
    },
    {
      "authorityClass": "heuristic",
      "category": "product-brief-validation",
      "evidenceClass": "owner-authored",
      "id": "ZTDE-BRIEF-203",
      "implementationLocations": [
        "src/product-brief/validator.ts"
      ],
      "modelLinks": [
        "ZTDE-MODEL-TASK-001"
      ],
      "owner": "ZtotheZ",
      "rationale": "Stable ZTDE-BRIEF-203 rule registry entry generated from maintained public source and bound to the V5 shadow model. This entry identifies where the rule is implemented or declared without making project policy an external legal or platform requirement.",
      "sourceIds": [
        "policy:ztothez-design-engineering-policy"
      ]
    },
    {
      "authorityClass": "heuristic",
      "category": "product-brief-validation",
      "evidenceClass": "owner-authored",
      "id": "ZTDE-BRIEF-301",
      "implementationLocations": [
        "src/product-brief/validator.ts"
      ],
      "modelLinks": [
        "ZTDE-MODEL-TASK-001"
      ],
      "owner": "ZtotheZ",
      "rationale": "Stable ZTDE-BRIEF-301 rule registry entry generated from maintained public source and bound to the V5 shadow model. This entry identifies where the rule is implemented or declared without making project policy an external legal or platform requirement.",
      "sourceIds": [
        "policy:ztothez-design-engineering-policy"
      ]
    },
    {
      "authorityClass": "heuristic",
      "category": "product-brief-validation",
      "evidenceClass": "owner-authored",
      "id": "ZTDE-BRIEF-302",
      "implementationLocations": [
        "src/product-brief/validator.ts"
      ],
      "modelLinks": [
        "ZTDE-MODEL-TASK-001"
      ],
      "owner": "ZtotheZ",
      "rationale": "Stable ZTDE-BRIEF-302 rule registry entry generated from maintained public source and bound to the V5 shadow model. This entry identifies where the rule is implemented or declared without making project policy an external legal or platform requirement.",
      "sourceIds": [
        "policy:ztothez-design-engineering-policy"
      ]
    },
    {
      "authorityClass": "heuristic",
      "category": "product-brief-validation",
      "evidenceClass": "owner-authored",
      "id": "ZTDE-BRIEF-303",
      "implementationLocations": [
        "src/product-brief/validator.ts"
      ],
      "modelLinks": [